Post Name,Title,Link,Phone Number,Go to web,Sub Title
Hello List,QuantumCloud,http://www.quantumcloud.com,4.57457E+11,1,QuantumCloud is the best Web Desing Company
Hello List,Web.Com.Bd,http://www.web.com.bd,46578697,1,Localy developed best web applications
Hello List,Web Design,http://www.quantumcloud.com,476737896,1,Best web design and development
Second List,ProthomAlo,http://prothom-alo.com,78697863789,1,Most popular bangla newspaper
Second List,Ittefaq,http://ittefaq.com,677867687,1,One of the old and famous bangla daily
Third List,Star Cineplex,http://cineplexbd.com,207678676,1,Premium Quality movie experience of the country
